proverb	topic
Ноги да руки — вот мои муки; а брюхо да живот — сохрани  господь (об еде и работе).	Человек
Ударить по рукам (дать слово, кончить дело).	Человек
Приложить руку (подписать). Отобрать заручную (подпись,  согласие).	Человек
Где рука, там и голова (т. е. дал слово — и отвечай).	Человек
Отбиваться от чего (противиться) и руками и ногами.	Человек
По рукам, по ногам связать (стеснить, отнять средства).	Человек
Он берет руками, а отдает ногами.	Человек
Через руку наливать (выворачивая кисть; дурная примета).	Человек
Она у нас глядит из рук (угождает).	Человек
Руки работают, а голова кормит.	Человек
В добрую голову сто рук (указчик и работник).	Человек
Глаза стращают, а руки делают. С руками нигде не пропадешь.	Человек
Рукам воли не давай! Языком болтай, а рукам воли не давай!	Человек
Не все сходит с рук. Что, до поры, с рук не сходило.	Человек
Которая рука крест кладет, та и нож точит.	Человек
Ноги обманут (т. е. не уйдешь), а руки до беды доведут (если  им волю дать).	Человек
Рука от руки погибает, а нога ногу подымает.	Человек
Нога ноге друг, а рука руке ворог.	Человек
Ноги носят, а руки кормят. Ноги с побежкой, руки с  подхватой.	Человек
И рука спит, и нога спит (о крепком сне).	Человек
Резвы ноги (колени) подломились, подсеклись, подкосились.	Человек
Скоморошьи ноги. Стрекозьи, паучиные ножки.	Человек
В ногах правды нет (от правежа? или о бегстве?).	Человек
На воде ноги жидки (не держат).	Человек
Не ноги кормят брюхо, а брюхо ноги.	Человек
Топтать кого ногами; затоптать в грязь.	Человек
Из милости башмачком до травки-муравки дотрогивается.	Человек
Конь бежит, земля дрожит (в шутку о неуклюжем топтыге).	Человек
Редьку садит (приседать на ходу).	Человек
Ножки, как лутошки (соломенны ножки).	Человек
Ножки скобками (или: оником) и ножки хером.	Человек
Борода — образ и подобие божие (раскольн.).	Человек
Борода в честь, а усы и у кошки есть. Ус в честь, а борода и  у козла есть.	Человек
Бородой в люди не выйдешь. Борода — трава, скосить можно.	Человек
Без рубля бороды не отрастишь (со врем. Петра I).	Человек
Борода делу не помеха.	Человек
Борода дороже головы (раскольн.).	Человек
Режь наши головы, не тронь наши бороды (раскольн.).	Человек
Железо глупо, а тело забористо (о бритье).	Человек
Борода лишняя тягота (Петр I).	Человек
Волос глуп, везде растет.	Человек
У нашей Федосьи из глаз растут волосьи.	Человек
Мудрость в голове, а не в бороде.	Человек
Борода — с посконное повесмо. Ус молодит, борода старит.	Человек
Мужичок с ноготок, а борода с локоток.	Человек
Борода с ворота, а ума и с прикалиток нету.	Человек
Сам с пядь, а борода с локоть. Сам с нос, борода с воз.	Человек
Старичок с кувшин, борода с аршин.	Человек
Борода выросла, а ума не вынесла. Бородастее белевского  раскольника.	Человек
По бороде Авраам, а по делам Хам.	Человек
Седина в бороду, а бес в ребро.	Человек
Борода нижегородка, а ум макарьевскни.	Человек
Под носом взошло, а в голове и не засеяно.	Человек
Волос долог (у бабы), а ум короток.	Человек
Ни голосу, ни волосу не верь! Шерстью все прикроешь.	Человек
Подавайся по рукам (когда дерут), легче будет волосам.	Человек
Волосы становятся дыбом. Ощетинился волос.	Человек
Ухватиться за волосы; рвать волосы (выйти из себя).	Человек
Волос в волос, голос в голос. Волос в волос, лицо в лицо.	Человек
Глядит, как сова, выпучив глаза.	Человек
Один глаз на полицу, другой в солоницу (о косом).	Человек
Один глаз на печь, другой в Галич.	Человек
Один глаз на нас, другой на Арзамас (стар. о мордве).	Человек
Один в Кесово, другой в Разлисово (два села Каш. у., Твер.  губ.)	Человек
Один глаз на мельницу, другой на кузницу.	Человек
И косое око видит далеко. Смотрит в кучку, а глядит врознь.	Человек
Косые счастливы. Кривые моты. Немые говорливы. Слепые  мудрены. Хромые баски (т. е. щеголи). Косолапые драчливы.	Человек
Кос, как Соловей-разбойник (который одним глазом на Киев,  другим на Чернигов глядел).	Человек
Плес крутой, глаз кривой — далече берут.	Человек
Слепому все копеечки. Слепой курице все пшеница.	Человек
Слеп, как крот, как медяница (змея, о коей говорили, что она  слепа).	Человек
Дальше носу не видит. Слепая курица.	Человек
Надень очки! Возьми глаза в руки (в зубы)!	Человек
Косой — не кривой. Косой — не слепой. Кривой — не слепой.	Человек
Кривой не беда, а горе криводушный.	Человек
С косым не толкуй о кривом! С кривым о косом не беседуй!	Человек
У кривого один глаз, а видит больше (дальше) нас.	Человек
Слепой и в горшке дороги не найдет.	Человек
Не верь ушам, верь очам! Не верь речам, верь своим глазам!	Человек
Паче слуха видение. Свой глаз алмаз (или: смотрок).	Человек
Глаз не видит, и ухо не слышит. Не видишь, так и не бредишь.	Человек
Глаза, что плошки, а не видят ни крошки.	Человек
Глаза сусального золота (тупоумные). Оловянные глаза.	Человек
Зрячий не видит, а невишной (слепой) налапает (нащупает).	Человек
Подслеповатый с придурью, пучеглазый с дурью.	Человек
Аль глаза в очешник схоронил? Аль глаза отсидел?	Человек
Гляди в оба! Слушай в оба, зри в три!	Человек
Вынь глаза-то с ножней (из ножен).	Человек
Говорит, слеп, а в избе печь нащупал. Еще то не слеп, коли в  избе печь нащупал.	Человек
Овин прогорел, а слепой проглядел.	Человек
Хороший, дурной глаз. Черный глаз, карий глаз — минуй нас!	Человек
Глаз черный, взгляд бойкий, обычай волчий.	Человек
Как ворон зырит (зорко глядит). Соколом глядит.	Человек
Ты зенок мой, зеница ока, ненаглядный.	Человек
Как глаз береги. Дороже глаза. Око мое ненаглядное.	Человек
Правда глаза колет. Правда, как оса, лезет в глаза.	Человек
Ни глаза во лбу, ни зуба во рту.	Человек
На глаз (т. е. на глазомер). Пройти на глаз (или: на  прогляд, по уровню).	Человек
Заглазное дело — не слышно. За глазами дело.	Человек
За глазами, что за горами. Позаочью — что ночью.	Человек
Сытых глаз на свете нет. Брюхо сыто, да глаза голодны.	Человек
Видом не видать, слыхом не слыхать.	Человек
Глазами гляди (Языком болтай), а рукам воли не давай!	Человек
Не глаза видят, а человек; не ухо слышит, а душа.	Человек
Уши — как папуши, а глаза — как бураки.	Человек
На то два уха, чтоб больше слухать.	Человек
Глухой — половина спасенья (не слышит беззаконий).	Человек
Уши — благодать божия, язык — проклятие.	Человек
Глухому много чуется, а слепому много видится.	Человек
Про глухого семью (семь раз) обедни не служат.	Человек
Заросли, что ль, у тебя уши? Аль ты бородой оброс, не  слышишь?	Человек
Расковырять, что ль, тебе уши-то. Давно, видно,оплеух не  едал, так уши залегли?	Человек
Затоковал, что глухарь (т. е. свое толкует, не слышит).	Человек
Глухому с немым нечего толковать.	Человек
Глух, как тетерев (как мошник). Глухая тетеря.	Человек
Он ухом задернул (т. е. не хочет слушать). Он на это ухо  глух.	Человек
У него на эту речь ухо заложило. Он заложил уши.	Человек
Глухой недослышит, так догадается.	Человек
Носом (Рылом) смерять (т. е. упасть). Носом наткнулся.	Человек
Это пахнет бедой (или: тем и тем).	Человек
А знаешь ли, чем это пахнет (т. е. чего ожидать).	Человек
Понюхай, чем пахнет (прочхайся да оклемайся)!	Человек
Не разевай рта: ворона влетит (и карета четверней въедет).	Человек
Суконный язык; язык с подбоем (о картавом или косноязычном).	Человек
И заика ложку мимо ушей не проносит.	Человек
У него язык длинен (долог). Язык свой враг злой.	Человек
Язык мой — враг мой (наперед ума лепечет).	Человек
Ни на меру, ни на вес, а при всяком есть (язык, речь).	Человек
Чего завсе хочется? (дышать). Чего всегда хочется? (ничего  не делать).	Человек
Чего над собою не видишь? (росту).	Человек
Что в воде не тонет, на огне не горит? (имя).	Человек
Без чего человеку жить нельзя? (без имени).	Человек
На поле Арском, на рубеже татарском, два орла орлуют, одним  языком балуют (крестины).	Человек
Во поле Епифанском, под деревом царским, три орла орлуют,  одним яйцом даруют (крестины).	Человек
Чем тебя мать родила? (Ответ: мальчиком либо девочкой).	Человек
Стоит град ни на воде, ни на земле, в том граде воевода нем  (ребенок в зыбке).	Человек
Лубен город, отрепьин город, а в том городе воевода нем  (ребенок в зыбке).	Человек
Утром на четырех ногах, в полдень на двух, под вечер на трех  (человек).	Человек
Три года — яйцо, тридцать лет — медведь, шестьдесят лет —  курица (младенец, середовой и старик).	Человек
Одного не знаю, другого не вижу, третьего не помню (смерть,  возраст и рождение).	Человек
Ни рыба, ни баран; сахар не бывал, на блюде не лежал, всяк  меня едал (кушал груди).	Человек
Ни гусь, ни баран, ножом не рушан, на блюде не лежал, всяк  его едал (груди).	Человек
Пришел гость из гостей, съел барана без костей; гость сыт и  баран цел (то же).	Человек
Пришли гости без вестей, убили барана без костей; гости  сыты, баран цел (кормилица с ребенком).	Человек
Ни печено, ни варено, на блюде не бывало, ножом не рушано, а  всяким кушано (груди).	Человек
Сахарный кусочек, на блюде не лежал, всяк его едал (груди).	Человек
Белый лебедь, никем не рушан, всяк его кушал (грудь).	Человек
Два комка, третья лакомка (груди и младенец).	Человек
Разница между школьником и огнем? (Огонь высекут, да и  разложат; а школьника сперва разложат, а там высекут).	Человек
Разница между каретой и деревней? (Карету заложат да поедут,  а деревню — поедут да и заложат).	Человек
Что слаще и что горче? (слово).	Человек
Царь видит редко, бог никогда, а мы завсегда (своего брата).	Человек
Пришел милый, да и повалил силой (сон).	Человек
Сорок недель в тюрьме сидел, два года на виселице висел  (человек).	Человек
Сорок недель сидел я в темнице, шесть недель в больнице,  двадцать недель меня вязали да год на виселице держали (человек).	Человек
Сидит живая живуличка на живом стульчике, теребит живое  мясцо (младенец).	Человек
За стеной, стеной барабанщик (или: каравашек) костяной  (младенец в утробе).	Человек
Стоит дуб, на дубу клуб, на клубе семь дыр (человек).	Человек
Шелков клуб, семь дыр вокруг (то же).	Человек
Стоят вилы, на вилах-то зевало, на зевале-то мочало, на  мочале кочка, а в кочке-то роются дочки (т. е. свиньи, по-вятски: человек).	Человек
Стоят вилы, на вилах короб, на коробе махалы (грабли), на  махалах хапало (кивало, на кивале зевало), на хапале нюхало, на нюхале мигало,  на мигале роща, а в роще-то свиньи роются (человек).	Человек
Стоят вилы, на вилах грабли, на граблях ревун, на ревуне  сапун, на сапуне глядун, на глядуне роща, а в роще свиньи роются (человек).	Человек
Стоят вилы, на вилах-то бочка, на бочке-то кочка, у кочки  махало, на кочке зевало, повыше мигала, а там лядина, в лядине скотина  (человек).	Человек
Стоит расоха, на расохе бебень, на бебене махало, на махале  зевало, на зевале чихало, на чихале мигало, на мигале остров (лес), в острову  звери (человек).	Человек
У двух матерей по пяти сыновей (пальцы). У двух матерей по  пяти сыновей, все в одно имя (то же).	Человек
Пять братьев родных, пять двоюродных, у них по пяти  внучатных (пальцы).	Человек
Между двух светил я в середине один (нос).	Человек
В чистом поле две трубы трубили, два соболя играли (лицо,  рот, нос, глаза).	Человек
Кругло, горбато, около мохнато; придет беда — потечет вода  (глаз).	Человек
Кругленьким, маленьким до неба докинешь (глаз).	Человек
На полке в кошличке лежит два яичка (глаза).	Человек
Два клубка через грядку висят (глаза).	Человек
Два двачка, два очка, два корытечка (глаза).	Человек
Под мостом, мостищем, под соболем, соболищем два соболька  разыгрались (глаза).	Человек
Под дугам, дугам, висит яблоко с кругам (глаз).	Человек
Круг города станет, круг головы недостанет (свои глаза).	Человек
Вожжи долги: вокруг поля достают, только вкруг кола не  достают (глаза).	Человек
Вожжи вкруг света обовьются, вкруг головы не обовьются  (глаза).	Человек
Вожжи мои, вожжи! Все поле извожжали, вокруг головушки не  стали (глаза).	Человек
Долги, долги вожжечки: до неба станут, а вкруг головы не  станут (глаза).	Человек
Вокруг земли обведу, а вокруг головы не обвести (глаза).	Человек
Два яичка в моху, да морковка наверху (глаза и нос).	Человек
Лежит доска середи мостка, не гниет и не сохнет (язык).	Человек
Лежит доска в болоте; ни сохнет, ни мокнет, ни ветреет, ни  куржавеет (язык).	Человек
Под небом дощечка — не сохнет, не мокнет и не куржавеет  (язык).	Человек
В море доска — не гниет, не сохнет (язык).	Человек
Мокренький теленочек под лавкой лежит (язык).	Человек
В темном подполье мокрый теленок лежит (язык).	Человек
За белыми березами тарара живет (язык).	Человек
Сечка сечет, деревяшка везет, сам Мартын поворачивает (зубы,  ложка и язык).	Человек
Деревяшка везет, костяшка сечет, мокрый Мартын подкладывает  (зубы, ложка и язык).	Человек
Рот до ушей — хоть завязки пришей!	Человек
Полно корыто гусей-лебедей намыто (зубы).	Человек
Полно подполье гусей-лебедей (то же).	Человек
Полон половень белых голубей (то же).	Человек
Полон кутник белых курок (то же).	Человек
Полон хлевец белых овец (то же).	Человек
Бисер мой, бисер, борочком снизан, алым бархатом опушен, под  заветом заложен (то же).	Человек
Плосконька дощечка, по краям обшивочка, а в середке дырочка  (ухо).	Человек
Вокруг носу вьется, а в руки не дается (запах).	Человек
Хоть дворянский нос, да песьего не стоит (по чутью).	Человек
Шесть ног, две головы и один хвост (вершник).	Человек
Две головы, один хвост, две руки и шесть ног(то же).	Человек
В лес еду — клетки кладу, из лесу еду — перекладываю  (лапотный след).	Человек
Кабы встал, кабы встал, так бы до неба достал; кабы руки да  ноги, так бы вора связал; кабы рот да глаза, так бы много рассказал (дорога).	Человек
Еду, еду, следу нету; режу, режу, крови нету; рублю, рублю,  щепок нету (плавание на лодке греблею).	Человек
Ниже бога, выше царя (смерть).	Человек
Ходит Хам по горам, берет ягоды с грибам (смерть).	Человек
На горе горынской стоит дуб сарацинской: никто его не  обойдет, не объедет, ни царь, ни царица, ни красна девица (смерть).	Человек
Стоит в поле столб: этого столба ни перейти, ни переехать,  хлебом не отманить, деньгами не откупить (смерть).	Человек
Стоит столб: на столбу цвет, под цветами котел, над цветами  орел: цветы срывает, в котел бросает, цветов не убывает, в котле не прибывает  (век, смерть и род человеческий).	Человек
Стоит дерево, на дереве птица цветы хватает, в корыто  бросает, корыта не наполняет и цветов не умаляет (то же).	Человек
Летит орел через немецки города, берет ягоды зрелы и не  зрелы (смерть).	Человек
Печь день и ночь печет, а невидимка дошлую ковригу  выхватывает (то же).	Человек
Летела птица орел, садилась на престол, говорила со Христом:  «Гой еси истинный Христос! Дал ты мне волю над всеми: над царями, над  царевичами, над королями, над королевичами; не дал ты мне воли ни в лесе, ни в  поле, ни на синем море» (смерть).	Человек
