proverb	topic
У меня рука легка — была бы шея крепка (или: толста).	Кара — Гроза
Пойду нараспашку да побью в размашку.	Кара — Гроза
Четыре дубинки березовые, пятый кнут, по заказу свит.	Кара — Гроза
Я тебя взвешу на костяной (или: на ременный) безмен.	Кара — Угроза
Небо с овчинку покажется. Небу жарко стало (или: станет).	Кара — Угроза
Запоешь ты не ту песню. Запоешь ты у меня не ту песенку.	Кара — Угроза
Запоешь ты не своим голосом. Запоешь свиным голосом.	Кара — Угроза
Ты у меня и места не найдешь.	Кара — Угроза
Ты от меня и в землю не уйдешь. Разве в землю от меня  уйдешь, а то везде найду.	Кара — Угроза
Я тебя заставлю рылом хрен копать.	Кара — Угроза
Я тебя, как кошку, уткну на это рылом.	Кара — Угроза
Я тебе покажу (или: дам знать) Кузькину мать.	Кара — Угроза
Узнаешь (или: попомнишь, будешь помнить) Кузькину мать.	Кара — Угроза
Не пей, кума, дарового вина (прибавка: дороже купленного  обойдется).	Кара — Угроза
Не шуми у браги: не позовут к пиву.	Кара — Угроза
Не гляди искоса: дам лососа.	Кара — Угроза
Не гляди косо — не дадут ососа.	Кара — Угроза
Не шуми во хмелю, когда я не верю.	Кара — Угроза
Где я лисой пройду, там три года куры не несутся.	Кара — Угроза
Узнаешь, чем крапива пахнет. Узнаешь вкус березовой каши.	Кара — Угроза
Не поминай бани: есть веники и про тебя.	Кара — Угроза
Будешь баню эту помнить (или: не забудешь) до новых веников.	Кара — Угроза
Взял бы вас двоих, связал по ноге да пустил бы по воде: кто  кого перетянет.	Кара — Угроза
Взял бы вас, связал бы вас, нога по ноге, да и пустил по  воде.	Кара — Угроза
Камня на камне не оставлю.	Кара — Угроза
Выжгу да пепел раскину на все четыре стороны.	Кара — Угроза
Конским хвостом пепел размету.	Кара — Угроза
Сожгу да и пепел-то заряжу в пушку да выстрелю на ветер.	Кара — Угроза
Заряжу тебя в пушку да выстрелю. Замест пыжа в пушку забью.	Кара — Угроза
Я вас всех на кишках перевешаю.	Кара — Угроза
Я из тебя все кишки повытереблю (или: вымотаю).	Кара — Угроза
Я тебя всего выпотрошу да соломой чучело набью.	Кара — Угроза
Я вас на плотах перевешаю да вниз спущу (было в стар. за  обычай, в страх бунтовщикам).	Кара — Угроза
Ты у меня кровью своей умоешься.	Кара — Угроза
Кровавыми слезами восплачешься.	Кара — Угроза
На него (на них, на меня) гроза грозная подымается.	Кара — Угроза
Из-за лесу и туча идет. Из-за гор туча встает.	Кара — Угроза
Вот дед придет, в мешке унесет (стращают детей).	Кара — Угроза
Вот ужо, погоди, придет дед, посадит тебя в мешок.	Кара — Угроза
Ужо вот тебя баба-яга в ступе унесет.	Кара — Угроза
Ходить тебе у заплечного мастера в подручных (или: в  пристяжных, т. е. быть сечену кнутом).	Кара — Угроза
Ты у меня еще на бирке зарублен. Ты у меня давно на бирке.	Кара — Угроза
Есть на моей бирке и твой рез (т. е. зарубка).	Кара — Угроза
Вырасту — вымещу. Малый вырастет — все выместит.	Кара — Угроза
Займу, да дойму.	Кара — Угроза
Сам наг пойду, а тебя без рубахи пущу.	Кара — Угроза
Свою голову положу, да твою-то с плеч снесу.	Кара — Угроза
Гуляй, ребята, поколе я гуляю, а заговеюсь, так я вас!	Кара — Угроза
Болтай, болтай — не далеко Валдай (о колокольчике).	Кара — Угроза
Будешь меня поминать, когда станешь кобылу за хвост  подымать.	Кара — Угроза
Запоешь ты у меня еще и не такую песню (не ту песенку).	Кара — Угроза
Был бы снежок, так скатаем комок.	Кара — Угроза
Смотри, на том свете поплатишься (или: ответ дашь).	Кара — Угроза
Это тебе соком выйдет (прибавка: боком выпрет).	Кара — Угроза
Это из тебя соком выжмут.	Кара — Угроза
Я тебя согну в дугу да и концы на крест сведу.	Кара — Угроза
Я тебе докажу дружбу. Будешь ты меня поминать (или:  помнить).	Кара — Угроза
Сунется, да окунется. Сунулся, да окунулся.	Гроза — Кара
Не сносить ему головы на плечах своих. Не сносить голова  (вм. головы, стар. в народе и доныне).	Гроза — Кара
Вижу, вижу, матушке скажу (из сказки).	Гроза — Кара
Не балуй, холуй: барину скажу.	Гроза — Кара
Не придуривай, невестка! дом-эт твой.	Гроза — Кара
Уходят (или: уходили, укачали) бурку крутые горки.	Гроза — Кара
Кошка скребет на свой на хребет.	Гроза — Кара
Повадился кувшин по воду — сломить ему голову.	Гроза — Кара
Повадился кувшин по воду ходить, там ему и голову сломить.	Гроза — Кара
Кто не слушается отца, матери, послушается телячьей шкуры  (барабана).	Гроза — Кара
Не слушался отца, матери, послушаешься ката.	Гроза — Кара
Не слушался отца, послушаешься кнутца.	Гроза — Кара
Не верти головою, как бешеная овца, не продали б татарам.	Гроза — Кара
Быть козе на бузе (буза — камен. соль; т. е. быть на  привязи).	Гроза — Кара
Быть бычку на веревочке (прибавка: хлебать лапшу на  тарелочке).	Гроза — Кара
По слуге бьют, не по заслугам.	Гроза — Кара
Старый хрыч, пора тебе спину стричь.	Гроза — Кара
Стар да глуп — больше бьют.	Гроза — Кара
Не по годам бьют (старого), а по бокам.	Гроза — Кара
Кавалер кавалера бьет (военная).	Гроза — Кара
Звонок бубен, да страшен игумен.	Гроза — Кара
Береза не угроза: где стоит, там и шумит.	Гроза — Кара
Угрозы глупым страх.	Гроза — Кара
Не бойся собаки: хозяин на привязи.	Гроза — Кара
Не стращай: придет смерть и без твоих гроз.	Гроза — Кара
Смерть не близко, так и не страшно; а близко — знать не  миновать.	Гроза — Кара
Не грози попу церковью: он от нее сыт живет.	Гроза — Кара
Не грози попу кадилом: им же кормится.	Гроза — Кара
Не грози (или: Не кори) барин хлебом, а слуга бегом (т. е.  один тем, что кормит, другой, что работает).	Гроза — Кара
Стали щуке грозить: хотят щуку в озере утопить.	Гроза — Кара
Не грози щуке морем, а нагому горем.	Гроза — Кара
Грози богатому: даст денежку щербатую.	Гроза — Кара
Журба твоя часовая, гульба моя вековая.	Гроза — Кара
Семь бед — один ответ.	Гроза — Кара
Грозцы грозят, а жильцы живут.	Гроза — Кара
Ты, матушка, грози; а ты, девушка, гуляй!	Гроза — Кара
Ты нагрозишься, а я наживусь (или: нагуляюсь).	Гроза — Кара
Ты, гроза, грозись, а мы друг за друга держись!	Гроза — Кара
Я с твоих гроз велик взрос.	Гроза — Кара
Легка рука: что ни пригрозит, то и поживем.	Гроза — Кара
Бог милостив: авось с твоих гроз богат буду.	Гроза — Кара
Грозцы грозят, а бог дает (или: посылает).	Гроза — Кара
Не пугай сокола вороной!	Гроза — Кара
Мертвым соколом и вороны не затравишь.	Гроза — Кара
Не бойся летня, а бойся гнетня (т. е. не бойся горячего,  бойся мстительного).	Гроза — Кара
Стращай того, кто не смыслит ничего!	Гроза — Кара
Грозит мышь кошке, да издалече (или: да из подполья, из  норы).	Гроза — Кара
Бил дед жабу, грозясь на бабу.	Гроза — Кара
Он в рукавице (или: в кармане) кукиш кажет.	Гроза — Кара
Я тебе слуга, да туга.	Гроза — Кара
Его сразу не раскусишь. Тугонек я тебе орешек дался.	Гроза — Кара
Тише пыли: не твои бобыли. Прощай, да не стращай!	Гроза — Кара
Не съешь меня. Не проглони меня целиком.	Гроза — Кара
Глядит, будто пятерых живьем (или: целиком) проглотил,  шестым поперхнулся.	Гроза — Кара
Что, аль живьем проглотишь? — Гляди, не поперхнись!	Гроза — Кара
Полно козырять. Что больно козыряешь? Что раскозырялся?	Гроза — Кара
Не поймав, не щиплют.	Гроза — Кара
И в руках не подержал, а уж и отеребил.	Гроза — Кара
Чайка кики, а казак хихи (т. е. смеется над вестницей дурной  погоды).	Гроза — Кара
Страшен сон, да милостив бог.	Гроза — Кара
Слыхивали мы слухи (или: сказки). Сказывали и мы сказки.	Гроза — Кара
Видывали мы виды.	Гроза — Кара
Видали мы, слыхали мы, и сами едали, и других кармливали.	Гроза — Кара
И мы видывали, да и не завидовали.	Гроза — Кара
Своих не стращай: наши и так не боятся.	Гроза — Кара
Гроз твоих не боюся, а ласка не нужна.	Гроза — Кара
Подбери губы-те: городничий едет (полно дуться, сердиться).	Гроза — Кара
Застрелю, да и хоронить не велю.	Гроза — Кара
Наш супостат хочет голову снять.	Гроза — Кара
Кто идет! Говори, убью: не дай домой за ружьем сбегать  (дразнят гарнизонных).	Гроза — Кара
Баба едет, хочет башню сбить; воевода глядит, куда башня  полетит.	Гроза — Кара
Разбил дед деревню, и баба — горшок.	Гроза — Кара
Не во всякой туче гром; а и гром, да не грянет; а и грянет,  да не по нас; а и по нас — авось опалит, не убьет.	Гроза — Кара
Не все бьет, что гремит.	Гроза — Кара
Не всяка собака кусает, котора лает.	Гроза — Кара
Не всяк кусает, кто усом трясет (или: усом моргает).	Гроза — Кара
Много грозит, да мало вредит.	Гроза — Кара
Кто много грозит, тот мало вредит.	Гроза — Кара
Не всяк умирает, кто хворает.	Гроза — Кара
Не всяка болезнь к смерти.	Гроза — Кара
Не всяка потягота к лихоманке (прибавка: иная к росту).	Гроза — Кара
Что зубы ощерил? Аль железо увидел?	Гроза — Кара
Еще казацка матка не умерла (т. е. сабля Богд.  Хмельницкого).	Гроза — Кара
Не велика птица.	Гроза — Кара
Не велика птица колпица.	Гроза — Кара
Невеличка птичка синичка.	Гроза — Кара
Мне и частный нипочем, был бы будочник знаком.	Гроза — Кара
Мне все нипочем, был бы будочник знаком.	Гроза — Кара
В начале всякое дело строго (о законе, начальстве).	Гроза — Кара
Снова метла резко мела, а обилась — притупела.	Гроза — Кара
Новый гребень дерет. Снову и гребень дерет, а причешется —  мирится.	Гроза — Кара
Обойдешь да огладишь, так и на строгого коня сядешь.	Гроза — Кара
Наш воевода, что понурая кобыла: за повод возьми, да куда  хошь веди.	Гроза — Кара
Вот воевода к нам ползет, щетинку в зубах несет (рак).	Гроза — Кара
На воеводу просить — наперед самому в тюрьму идтить.	Гроза — Кара
За наши грехи и Терехи дьяки.	Гроза — Кара
Наказал бог народ — наслал воевод.	Гроза — Кара
Худо овцам, где волк в пастухах. Плохо овцам, коли волк  пастух.	Гроза — Кара
Староста по накладке не тужит (по прибавке расходов).	Гроза — Кара
Правит, как черт болотом.	Гроза — Кара
Правит, как медведь в лесу дуги гнет (прибавка: гнет — не  парит, а переломит — не тужит).	Гроза — Кара
Воевода год помечает, а два отвечает. Год пометы, а три  ответа (от старин. срока).	Гроза — Кара
Дьяк у места, что кот у теста; а дьяк на площади (т. е. у  казни) — так, господи, прости (или: помози).	Гроза — Кара
Как дьяк у места, так всем от него тесно; а как дьяк на  площади, так, господи, пощади!	Гроза — Кара
Таскал волк — потащили и волка.	Гроза — Кара
Гоняет волк, а как погонят волка?	Гроза — Кара
Вот волку несут, а как волка-то понесут?..	Гроза — Кара
Помутися народ, накорми воевод! Помути бог народ, накорми  воевод!	Гроза — Кара
Овцы и мрут и ягнятся, а пастухи все жирятся.	Гроза — Кара
У старосты с приказчиком лад — помещику наклад.	Гроза — Кара
Кошки грызутся — мышам приволье (или: раздолье).	Гроза — Кара
Пастухи за чубы, а волки за овец.	Гроза — Кара
Орлы бьются, а молодцам перья достаются.	Гроза — Кара
Попадешься в руки — натерпишься муки.	Гроза — Кара
Пуще божьего милосердия (изобью, покараю).	Гроза — Кара
Тяжело голове без плеч, худо и телу без головы.	Гроза — Кара
Судить-рядить не умеет, а бить разумеет.	Гроза — Кара
И всяк водит, да не всяк доводит!	Гроза — Кара
Не говоря худого слова, да в рыло (или: да по загривку).	Гроза — Кара
Он не дает мне и пальцем пошевелить!	Гроза — Кара
Не смей (или: Не смеет) перед ним пикнуть.	Гроза — Кара
Будешь ты кулаком слезы утирать.	Гроза — Кара
Без шапки стоя, не много наговоришь.	Гроза — Кара
Переминаясь с ноги на ногу, не раскалякаешься.	Гроза — Кара
Начальство не свой брат: много говорить не станешь.	Гроза — Кара
Барин говорит горлом, мужик горбом (т. е. только кланяется).	Гроза — Кара
Он из своих рук правит (или: управляет, т. е. дерется).	Гроза — Кара
Укроти, господи, командирское сердце!	Гроза — Кара
Рад госпоже, что меду на ноже (прибавка: полижешь, да и  обрежешься).	Гроза — Кара
Честь добра — во всю спину равна.	Гроза — Кара
Не одним головой свет стоит (т. е. не одним волостным  головой. Иначе: Не об одной голове, или: Не одной головой свет стоит).	Гроза — Кара
Есть и на черта гром (или: гроза).	Гроза — Кара
Кусают и комары до поры. Рубят и топоры до поры.	Гроза — Кара
Вырос лес, так выросло и топорище.	Гроза — Кара
Вода с гор, так и речки мутны (говор. о слугах).	Гроза — Кара
С гор вода налегла — и речки помутились.	Гроза — Кара
Коли худ князь, так в грязь (говор. новгородцы).	Гроза — Кара
Не с добра волости встают.	Гроза — Кара
Все ну, да ну, а тпрукнуть-то и некому.	Гроза — Кара
Поводья затянуть (о чрезмерной строгости).	Гроза — Кара
На ретивую лошадь не кнут, а вожжи.	Гроза — Кара
Не спеши карать, спеши миловать!	Гроза — Кара
Не спеши голову рубить, прикажи наперед речь говорить!	Гроза — Кара
Виноватого кровь вода, а невинного беда.	Гроза — Кара
Не спеши казнить, дай выговорить!	Гроза — Кара
Не прикажи голову рубить, прикажи речь говорить (или: слово  выговорить).	Гроза — Кара
Остер шип на подкове — скоро сбивается.	Гроза — Кара
Где грозно, там и розно (или: там и честно).	Гроза — Кара
От грозы либо все в кучу, либо все врознь.	Гроза — Кара
Не слушаешь духа кротости, так палкой по кости.	Гроза — Кара
Виноватых прощают, а правых жалуют. Виноватого бог простит,  а правого царь пожалует.	Гроза — Кара
Ступай домой — и бог с тобой.	Гроза — Кара
Невольный грех (или: прегрешение) отпускается.	Гроза — Кара
В первой вине и бог прощает.	Гроза — Кара
До двух раз прощают и в третьи бьют.	Гроза — Кара
Всякая вина виновата. Не всякая вина виновата.	Гроза — Кара
Третья вина виновата.	Гроза — Кара
До трех раз прощай! Три раза прости, в четвертый похворости!	Гроза — Кара
Десятая вина виновата (когда наказывают десятого).	Гроза — Кара
Тюрьма не дурна: пуста (или: без жильцов) не стоит.	Гроза — Кара
На деле прав, да на дыбе (т. е. пытке) виноват.	Гроза — Кара
И поят, и кормят, и спину порют.	Гроза — Кара
По горбу-то всяк, а под губу (или: по сердцу) никто.	Гроза — Кара
Изручь бьет, да не изручь кормит.	Гроза — Кара
Бить-бранить есть кому, кормить некому.	Гроза — Кара
Веников много, да пару нет.	Гроза — Кара
Почем нанялись? — Да семь дней работы, а спать на себя (или:  про себя).	Гроза — Кара
Друг на дружку, а все на Петрушку.	Гроза — Кара
Аль я виновата, что рубаха дыровата?	Гроза — Кара
Не от свата, что девка космата.	Гроза — Кара
Помнит свекровь свою молодость и снохе не верит.	Гроза — Кара
Мал грех, да большую вину несет (или: творит).	Гроза — Кара
Этот грех — и всего-то три пятницы молока не хлебать.	Гроза — Кара
Наш грех стыдно и попу сказать (т. е. так ничтожен).	Гроза — Кара
Грех с орех, ядро с ведро (т. е. преувеличен).	Гроза — Кара
Грех грехом, а вина виной.	Гроза — Кара
Дело не велико, да воевода крут: свил мочальный кнут.	Гроза — Кара
И кнут не дороже ста рублев (т. е. наказывали им за сто  рублей кражи).	Гроза — Кара
Милости просим, отец Абросим: тебе ли с нами — садись под  иконы (насмешка).	Гроза — Кара
Прости меня, моя мила, что ты меня била (говор. муж жене).	Гроза — Кара
И сердится, да умилосердится.	Гроза — Кара
