proverb	topic
Доброму делу не кайся. Сделав добро, не кайся (не попрекай).	Добро — Милость — Зло
Добрым делом не кори.	Добро — Милость — Зло
Добро худо переможет. Не устоять худу против добра.	Добро — Милость — Зло
Лихо помнится, а добро век не забудется.	Добро — Милость — Зло
Добро и во сне хорошо.	Добро — Милость — Зло
На свете не без добрых людей.	Добро — Милость — Зло
Злой не верит, что есть добрые люди.	Добро — Милость — Зло
Не век жить, а век поминать.	Добро — Милость — Зло
Доброму добрая память.	Добро — Милость — Зло
Ласковое слово не трудно, а споро.	Добро — Милость — Зло
Добрый скорее дело сделает, чем сердитый.	Добро — Милость — Зло
Ласково слово многих прельщает.	Добро — Милость — Зло
Ласково слово — что весенний день.	Добро — Милость — Зло
Его ласка не коляска: не сядешь да не поедешь.	Добро — Милость — Зло
На ласковое слово не кидайся, на грубое не гневайся.	Добро — Милость — Зло
На ласковое слово не сдавайся, на противное не осержайся.	Добро — Милость — Зло
На сердитое слово не осержайся, а на ласковое не надейся.	Добро — Милость — Зло
Гнева не пугайся, на ласку не кидайся.	Добро — Милость — Зло
Горьким быть — расплюют, сладким — проглотнут.	Добро — Милость — Зло
Горького проклянут, а сладкого проглотят.	Добро — Милость — Зло
Сердитого невзлюбили, а милостивого с кругу сбили.	Добро — Милость — Зло
Плохого бога (т. е. идола) и телята лижут.	Добро — Милость — Зло
Не корми калачом, да не бей в спину кирпичом.	Добро — Милость — Зло
Не кори барин слугу хлебом, а слуга барина бегом (т. е.  работой).	Добро — Милость — Зло
Не все таской, ино и лаской.	Добро — Милость — Зло
Не все по затылку, ино и по головке.	Добро — Милость — Зло
Не все хлыстом, ино и свистом.	Добро — Милость — Зло
Духом кротости, а не палкой по кости.	Добро — Милость — Зло
Не все линьком, ино и свистком (матросок.).	Добро — Милость — Зло
Не бей мужика дубьем (или: дубиной), бей его рублем  (полтиной).	Добро — Милость — Зло
Милостивому человеку и бог подает.	Добро — Милость — Зло
Болезному (или: Несчастному, т. е. наказанному преступнику)  милость творить — с господом богом говорить.	Добро — Милость — Зло
Милость и на суде хвалится. Красна милость и в правде.	Добро — Милость — Зло
Милость подпора правосудию.	Добро — Милость — Зло
Он мухи не убьет. Он и во сне комара не убьет.	Добро — Милость — Зло
Наш Авдей никому не здлодей.	Добро — Милость — Зло
Мудрость змеина, незлобивость (или: кротость) голубина.	Добро — Милость — Зло
И у курицы сердце есть.	Добро — Милость — Зло
Такой сякой немазаный (ласка).	Добро — Милость — Зло
Кого дедушка любит, тому и косточки в руки. Всякое даяние  благо.	Добро — Милость — Зло
На милость образца нет. Не худо, что просвира с полпуда.	Добро — Милость — Зло
Не подуйте на нас холодным ветром.	Добро — Милость — Зло
Жаль, жаль, а пособить нечем.	Добро — Милость — Зло
Жилы рвутся от тяжести, слезы льются от жалости.	Добро — Милость — Зло
Сердце кровью обливается. Сердце кровью подплывает.	Добро — Милость — Зло
Жаль девки — потеряла (или: погубила) парня.	Добро — Милость — Зло
Не жалей того, кто скачет; жалей того, кто плачет (и наоборот).	Добро — Милость — Зло
Жалеть коня — истомить себя.	Добро — Милость — Зло
Гостей разжалобить — не самому заплакать.	Добро — Милость — Зло
От жали (или: жалости) не плакать стать.	Добро — Милость — Зло
Его плачем не разжалобишь.	Добро — Милость — Зло
Немилостивому мил не будешь.	Добро — Милость — Зло
От лихого не услышишь доброго слова.	Добро — Милость — Зло
Не взяла бы лихота, не возьмет и теснота.	Добро — Милость — Зло
Не теснота губит, лихота.	Добро — Милость — Зло
У каменного попа, да железные просвиры.	Добро — Милость — Зло
Его копейка нищему руку прожжет.	Добро — Милость — Зло
На что на того сердиться, кто нас не боится?	Добро — Милость — Зло
Хорошо того бить, кто плачет, а учить, кто слушается.	Добро — Милость — Зло
Гневайся, да не согрешай.	Добро — Милость — Зло
Гневаться — дело человеческое, а злопомнить — диавольское.	Добро — Милость — Зло
Гнев — человеческое, а злопамятство — диавольское.	Добро — Милость — Зло
Зла за зло не воздавай.	Добро — Милость — Зло
Кривого кривым (худого худым) не исправишь.	Добро — Милость — Зло
Заднего не поминать (или: не помнить). Старого не поминать.	Добро — Милость — Зло
Старого пономаря не перепономаривать стать.	Добро — Милость — Зло
Не поминай лихом.	Добро — Милость — Зло
Не давай воли языку во пиру, во беседе, а сердцу в гневе.	Добро — Милость — Зло
Язык держи, а сердце в кулак сожми.	Добро — Милость — Зло
Кто гнев свой одолевает, крепок бывает.	Добро — Милость — Зло
Господин гневу своему — господин всему.	Добро — Милость — Зло
Не всяк злодей, кто часом лих.	Добро — Милость — Зло
Туча не без грому, хозяин (или: господин) не без гнева.	Добро — Милость — Зло
Где гнев, там и милость.	Добро — Милость — Зло
У часу гнев, у часу милость.	Добро — Милость — Зло
Хотя осердится, да после смирится (т. е. помирится).	Добро — Милость — Зло
Согрелся — осердился, простыл — остудился.	Добро — Милость — Зло
Бог простит, только вперед не каверзи.	Добро — Милость — Зло
Виноватого бог простит, правого царь пожалует.	Добро — Милость — Зло
Бог ему (или: тебе) судья. Господь с тобой.	Добро — Милость — Зло
Суди бог обидчика (грешника), а человек прощает.	Добро — Милость — Зло
Тому тяжело, кто помнит зло. Мста (месть) не мзда.	Добро — Милость — Зло
Откуда вред, туда и нелюбовь.	Добро — Милость — Зло
Всякая щель пищит (т. е. где горе, там и жалоба).	Добро — Милость — Зло
Тебе потехи, да мне худые смехи.	Добро — Милость — Зло
За добро постоим, а на зло настоим.	Добро — Милость — Зло
Не дразни собаку, так не укусит.	Добро — Милость — Зло
Сердитая собака волку корысть.	Добро — Милость — Зло
Бьют волка и в чужом колке.	Добро — Милость — Зло
Распазить да навоз возить (т. е. на тебе).	Добро — Милость — Зло
На сердитых воду возят.	Добро — Милость — Зло
Злой человек не проживет в добре век.	Добро — Милость — Зло
У сердитого губа толще, а брюхо тоще (или: тоньше).	Добро — Милость — Зло
Не на мать: губ не надуешь (т. е. привык на мать дуться).	Добро — Милость — Зло
Доброму и сухарь на здоровье, а злому и мясное не впрок.	Добро — Милость — Зло
Не бей в чужие ворота плетью; не ударили бы в твои дубиной  (или: обухом).	Добро — Милость — Зло
Не избывай постылого: приберег бог милого.	Добро — Милость — Зло
Кути и мути, да норови, как бы самому уйти.	Добро — Милость — Зло
Кабы свинье рога — всех бы со свету сжила.	Добро — Милость — Зло
Бодливой корове бог рог не дает.	Добро — Милость — Зло
Бодливая корова комола живет.	Добро — Милость — Зло
Сердит, да бессилен — свинье брат.	Добро — Милость — Зло
Под чужую голову идти — наперед свою нести (или: свою  навстречу нести).	Добро — Милость — Зло
О чужой голове биться — свою на кон ставить.	Добро — Милость — Зло
Хорошо кукуешь — да на свою б голову.	Добро — Милость — Зло
Пропади мой злодей, меня не избыв, а избывши меня — хоть три  века живи. Пропади мой лихой, не изведши меня, а изведши меня и пр.	Добро — Милость — Зло
Ешь собака собаку, а последнюю черт съест (или: а последняя  удавись).	Добро — Милость — Зло
Когда б на крапиву не мороз, то б с нею и ладов не было.	Добро — Милость — Зло
Коли б на хмель не мороз, так он бы через тын перерос.	Добро — Милость — Зло
Худая трава из поля вон.	Добро — Милость — Зло
Бодливую корову с поля долой (или: из стада вон).	Добро — Милость — Зло
Во зле жить — по миру ходить.	Добро — Милость — Зло
Лихо до дна, а там дорога одна.	Добро — Милость — Зло
Желание грешных погибает.	Добро — Милость — Зло
Сердцем ничего не возьмешь (или: не сделаешь).	Добро — Милость — Зло
Сердце делу не в помощь (или: не поможет).	Добро — Милость — Зло
Не сердись, печенку испортишь (или: печенка лопнет).	Добро — Милость — Зло
Не стало (или: Не хватило) легких, так заговорил печенкой.	Добро — Милость — Зло
Сердито — неумно, а хлопотливо — несбойливо.	Добро — Милость — Зло
Сердитый с горшками не ездит (потому что перебьет).	Добро — Милость — Зло
Сердцем притчи (или: притки) не изломишь.	Добро — Милость — Зло
Сердцем и соломинки не переломишь.	Добро — Милость — Зло
Сердись не сердись, а лучше покорись.	Добро — Милость — Зло
Чем сердиться (или: браниться), так лучше помириться.	Добро — Милость — Зло
Сердцем копья у недруга не переломишь.	Добро — Милость — Зло
Сердце не дробит — голова не болит.	Добро — Милость — Зло
Старуха три года на мир сердилась, а мир того и не знал.	Добро — Милость — Зло
Сердилась баба на торг, а торг про то не ведает.	Добро — Милость — Зло
Сердита кобыла на воз, а прет его под гору и в гору.	Добро — Милость — Зло
Скачет баба задом и передом, а дело идет своим чередом.	Добро — Милость — Зло
Сердитого унимать — пуще поднимать.	Добро — Милость — Зло
Сердитому кланяться, а он пуще чванится.	Добро — Милость — Зло
Сердитый умрет — никто его не уймет.	Добро — Милость — Зло
Рассердился — никого не спросился.	Добро — Милость — Зло
Душа не стерпит, так сердце возьмет. Возьмет сердце, как  душа не стерпит.	Добро — Милость — Зло
У злой Натальи все люди канальи.	Добро — Милость — Зло
У кого желчь во рту, тому все горько.	Добро — Милость — Зло
Каков ни есть: не перерожать его стать.	Добро — Милость — Зло
Это слабость его. Это его слабая струна (или: сторона).	Добро — Милость — Зло
Он на эту ногу немножко храмлет (или: прихрамывает).	Добро — Милость — Зло
В нем блох много. Ох-ох, много в тебе блох.	Добро — Милость — Зло
Извелся человек — никуда не годен.	Добро — Милость — Зло
Взял с сердцем, так и ешь с перцем.	Добро — Милость — Зло
Приткнуть кому грош (казанск., бедняк, назло богачу, втыкает  ему в избу грош, и тот должен разориться).	Добро — Милость — Зло
Лезть на стену. Себя не помнит, на стену лезет.	Добро — Милость — Зло
Горяч молодец уродился.	Добро — Милость — Зло
Сердце яро, место мало, расходиться негде.	Добро — Милость — Зло
За собакой палка не пропадет (т. е. припомнит).	Добро — Милость — Зло
Сердитому палка найдется. Сердитый найдет палку.	Добро — Милость — Зло
От него ни крестом, ни пестом не отделаешься.	Добро — Милость — Зло
От него ни отмолиться, ни отбиться.	Добро — Милость — Зло
Ни отмолиться, ни отплеваться, ни отлаяться, ни отчураться.	Добро — Милость — Зло
От черта крестом, от свиньи пестом, а от лихого человека —  ничем.	Добро — Милость — Зло
Дьяволом подложен, бесом опушен.	Добро — Милость — Зло
У него черт в подкладке, сатана в заплатке.	Добро — Милость — Зло
Не надо и беса, коли ты здеся.	Добро — Милость — Зло
В очью назло делает. Пальцем тычет, словом притыкает.	Добро — Милость — Зло
Назло да наперекор, да людям в укор.	Добро — Милость — Зло
Не из корысти собака кусает, из лихости.	Добро — Милость — Зло
Змея кусает не для сытости, а ради лихости.	Добро — Милость — Зло
Он давно на него зубы скалит.	Добро — Милость — Зло
Он давно на меня нож точит.	Добро — Милость — Зло
Беда, как расходился. Так ходенем и ходит.	Добро — Милость — Зло
Кошкой в глаза мечется.	Добро — Милость — Зло
Расходится, так и черт ему не брат.	Добро — Милость — Зло
Наш Козьма все бьет со зла (или: бьет с козла).	Добро — Милость — Зло
Сказали: бешеных всех перевешали; неправду сказали: одного  не связали.	Добро — Милость — Зло
Дураки да бешены, знать, не все перевешаны.	Добро — Милость — Зло
Сытый волк смирнее завистливого человека.	Добро — Милость — Зло
Как ворон крови ждет (или: зырит).	Добро — Милость — Зло
Ему на голодный зуб не попадайся.	Добро — Милость — Зло
Смотрит, как волк на теля.	Добро — Милость — Зло
Глядит, ровно семерых проглотил, осьмым поперхнулся.	Добро — Милость — Зло
Не гляди на меня комом, гляди россыпью.	Добро — Милость — Зло
Бирюком (или: волком, медведем) смотрит.	Добро — Милость — Зло
Глядит, как змея из-за пазухи. Ястребом смотрит.	Добро — Милость — Зло
Косится, как середа на пятницу.	Добро — Милость — Зло
В кривом глазу и прямое криво. В кривом зеркале и рот  набоку.	Добро — Милость — Зло
Надулся, как индюк (как индейский петух).	Добро — Милость — Зло
Надулся, как мышь на крупу.	Добро — Милость — Зло
Замашка воловья — глядеть исподлобья.	Добро — Милость — Зло
Что остробучился, ровно черт на попа?	Добро — Милость — Зло
С ободранного шкуру дерет. С одного вола две шкуры дерет.	Добро — Милость — Зло
С живого кожу дерет. Дерет с живого и с мертвого.	Добро — Милость — Зло
Ты — чтоб живот поправить, а он кишки вовсе вон теребит  (горшок, накинутый на брюхо).	Добро — Милость — Зло
Сжалился волк над ягненком, покинул кости да кожу.	Добро — Милость — Зло
Кобыла с волком тягалась: один хвост да грива осталась.	Добро — Милость — Зло
Пожалел волк кобылу: покинул хвост да гриву.	Добро — Милость — Зло
С тобой водиться — что в крапиву садиться.	Добро — Милость — Зло
С тобой знаться — от людей отстать.	Добро — Милость — Зло
Про твое здоровье и говорить скоромно.	Добро — Милость — Зло
Как на лес взглянет, так и лес вянет.	Добро — Милость — Зло
На что ни взглянет — все вянет.	Добро — Милость — Зло
Где ногой ступит — трава не растет.	Добро — Милость — Зло
Где я лисой пройду, там три года куры не несутся.	Добро — Милость — Зло
Хоть его в сад посади, и сад привянет.	Добро — Милость — Зло
Словно топор: не обрежет, так зашибет.	Добро — Милость — Зло
Пивица (пиявица) вопьется — год не сорвется.	Добро — Милость — Зло
Как душа черна, так и мылом не смоешь.	Добро — Милость — Зло
Хоть сам наг пойду, а недруга без рубахи пущу.	Добро — Милость — Зло
Сам наг пойду, а тебя как бубна пущу.	Добро — Милость — Зло
Хоть рыло в крови, да наша взяла.	Добро — Милость — Зло
Не дал шапки отец, так пусть уши мерзнут.	Добро — Милость — Зло
Запустить кому гусара (т. е. досадить. Буквально: пощекотать  сонного в носу).	Добро — Милость — Зло
Подпустить кому кузьку (досадить).	Добро — Милость — Зло
Я тебе покажу кузькину мать. Узнаешь ты кузькину мать.	Добро — Милость — Зло
Подкузьмить кого (т. е. поддеть).	Добро — Милость — Зло
Приставить кому горчишник (т. е. досадить).	Добро — Милость — Зло
Подсыпать кому перцу. Запустить кому шпильку.	Добро — Милость — Зло
Подвести кого под сюркуп (от карточн. игры).	Добро — Милость — Зло
Подвести дела под монастырь (убить короля тузом).	Добро — Милость — Зло
Всучить кому щетинку. Влить кому щей на ложку.	Добро — Милость — Зло
Задать кому закуску. На-ка, раскуси.	Добро — Милость — Зло
Это невестке на отместку.	Добро — Милость — Зло
Отсмеять насмешку (т. е. отомстить).	Добро — Милость — Зло
Я им заварил ушицу (или: кашицу), путь расхлебывают.	Добро — Милость — Зло
