proverb	topic
Жить — богу служить.	Бог — Вера
Кто велик, яко бог наш (Влад. Моном.).	Бог — Вера
Не нам, не нам, но имени твоему (т. е. слава).	Бог — Вера
Велико имя господне на земли.	Бог — Вера
В мале бог, и в велике бог.	Бог — Вера
Разумейте, языцы, яко с нами бог.	Бог — Вера
Сильна божья рука. Божья рука — владыка.	Бог — Вера
Бог не в силе, а в правде. Не в силе бог, а в правде.	Бог — Вера
Сила господня в немощи (или: в немощах) совершается.	Бог — Вера
Что богу не угодно, то и не сильно (или: не годно).	Бог — Вера
Велик бог милостию. Богат бог милостию.	Бог — Вера
У бога милости много. Бог на милость не убог.	Бог — Вера
Бог не убог; у бога милости много.	Бог — Вера
У бога всего много. У бога все возможно.	Бог — Вера
Милостив бог, а я, по его милости, не убог.	Бог — Вера
Во времени подождать: у бога есть что подать.	Бог — Вера
Божья вода по божьей земле бежит.	Бог — Вера
Божья роса божью землю кропит.	Бог — Вера
Ни отец до детей, как бог до людей.	Бог — Вера
Друг по друге, а бог по всех. Друг обо друге, а бог обо всех  (печется).	Бог — Вера
Всяк про себя, а господь про всех.	Бог — Вера
Не по грехам нашим господь милостив.	Бог — Вера
Бог напитал, никто не видал (прибавка: а кто и видел, тот не  обидел).	Бог — Вера
Бог пристанет (или: наставит) и пастыря приставит.	Бог — Вера
Даст бог день, даст бог и пищу.	Бог — Вера
После стрижки господь на овец теплом пахнет.	Бог — Вера
Его бог благословил (детьми, богатством, досужеством,  дородством и пр.).	Бог — Вера
Аще бы (или: Кабы) не бог, кто бы нам помог?	Бог — Вера
Бог не как свой брат, скорее поможет (или: проси, так  поможет).	Бог — Вера
Бог поберег вдоль и поперек.	Бог — Вера
Бог полюбит, так не погубит.	Бог — Вера
У бога для праведных места много.	Бог — Вера
С богом пойдешь — до блага дойдешь (к добру путь, или:  добрый путь найдешь).	Бог — Вера
На бога положишься, не обложишься.	Бог — Вера
С богом хоть за море (прибавка: а без бога ни до порога).	Бог — Вера
Нужен путь бог правит. Бог пути кажет.	Бог — Вера
Человек ходит, бог водит.	Бог — Вера
Бог люб — и в люди ведут.	Бог — Вера
Отстанет бог, покинут и добрые люди.	Бог — Вера
Не конь везет, бог несет.	Бог — Вера
Бог даст, и в окошко подаст (т. е. далеко не ищи).	Бог — Вера
Кто к богу, к тому и бог.	Бог — Вера
Кто любит бога, добра получит много.	Бог — Вера
Любящих и бог любит.	Бог — Вера
Бог не дремлет — все слышит.	Бог — Вера
Тот не унывает, кто на бога уповает.	Бог — Вера
Не унывай, на бога уповай (или: а бога призывай).	Бог — Вера
Аще бог с нами, никто же на ны.	Бог — Вера
Коли бог по нас, то никто на нас (или: против нас).	Бог — Вера
Бог по ны, никто же на ны. Бог по нас, никто же на нас.	Бог — Вера
Чего бог не нашлет, того человек не понесет.	Бог — Вера
Бог души не вынет, сама душа не выйдет.	Бог — Вера
Все в мире творится не нашим умом, а божьим судом.	Бог — Вера
Божьи невольники счастливы.	Бог — Вера
Никто не может, так бог поможет.	Бог — Вера
Грозную тучу бог пронесет.	Бог — Вера
Человек предполагает, а бог располагает (перевод).	Бог — Вера
Человек так, а бог инак. Человек по-своему, а бог по-своему.	Бог — Вера
Человек так, да бог не так.	Бог — Вера
Бог свое строит. Ты свое, а бог свое.	Бог — Вера
Человек гадает, а бог совершает.	Бог — Вера
На человеческую глупость есть божья премудрость.	Бог — Вера
Ты к худшему, а бог к лучшему.	Бог — Вера
Один воин тысячи водит, а бог и тысячи и воина водит.	Бог — Вера
Человек (или: Кто) с лихостию, а бог с милостию.	Бог — Вера
Мы с печалью, а бог с милостью.	Бог — Вера
Он его бранит, а бог его хранит.	Бог — Вера
Бог не мужик (т. е. не обидит): бабу отымет, а девку даст (о  вдовце).	Бог — Вера
Мужик на мужика осил надевает, а бог свое содевает.	Бог — Вера
Бог за худое плательщик.	Бог — Вера
Страшен сон, да милостив бог.	Бог — Вера
Без бога и червяк сгложет.	Бог — Вера
Постыжет бог суды человеческие (св. Дмитрий Ростовский).	Бог — Вера
Бог не захочет, и пузырь не вскочит.	Бог — Вера
Кабы бог послушал худого пастуха, так бы весь скот выдох (по  частой брани его: чтоб ты издохла!).	Бог — Вера
Кому на поле божья помощь. Кому на бою божья милость  (старин., от судебных поединков).	Бог — Вера
Бог не даст (или: не выдаст), свинья не съест.	Бог — Вера
Бог попущает, и свинья гуся съедает.	Бог — Вера
Жив бог — жива душа моя.	Бог — Вера
Бог не Макешь (или: Мокошь, языческое божество), чем-нибудь  да потешит.	Бог — Вера
Бог кормилец, не как мужик возгривец.	Бог — Вера
Коли богу угодно. Коли бог велит. Как богу угодно. Богу  соизволящу, попускающу. Как бог попустит.	Бог — Вера
Умная голова, разбирай божьи дела!	Бог — Вера
Бог — старый чудотворец.	Бог — Вера
Все от бога. Всяческая от творца.	Бог — Вера
У бога-света с начала света все доспето.	Бог — Вера
Божеское не от человека, а человек от бога.	Бог — Вера
Божьей воли не переможешь (или: не переволишь).	Бог — Вера
Выше божьей воли не будешь (не станешь).	Бог — Вера
С богом не поспоришь. С богом не спороваться.	Бог — Вера
Не по нашему хотенью, а по божью изволенью.	Бог — Вера
Не нашим умом, а божьим судом.	Бог — Вера
Господь богатит и высит, убожит и смиряет.	Бог — Вера
Божье тепло, божье и холодно.	Бог — Вера
Бог вымочит, бог и высушит.	Бог — Вера
Который бог вымочит, тот и высушит.	Бог — Вера
Бог отымет, бог и подаст. Бог дал, бог и взял.	Бог — Вера
Все мы под богом ходим.	Бог — Вера
Власть господня. Воля божья. Святая воля его.	Бог — Вера
Под богом ходишь, и власть его (или: божья и власть).	Бог — Вера
Под богом ходишь — божью волю носишь.	Бог — Вера
На волю божью просьбы не подашь.	Бог — Вера
Чего бог не даст, того никто не возьмет.	Бог — Вера
Что богу угодно, то и пригодно.	Бог — Вера
Бог по силе крест налагает.	Бог — Вера
Бог лучше знает, что дать, чего не дать.	Бог — Вера
Бог не даст — нигде не возьмешь.	Бог — Вера
Господня воля — наша доля.	Бог — Вера
Суди, господи, волю свою!	Бог — Вера
В делах человеческих сам бог послух (свидетель).	Бог — Вера
Бог видит, кто кого обидит (или: кто кого любит).	Бог — Вера
Бог видит, кто куда (или: что куда) идет.	Бог — Вера
Бог не гуляет, а добро перемеряет (говорится при перемене  счастья).	Бог — Вера
Не скор бог, да меток.	Бог — Вера
Бог долго ждет, да больно бьет.	Бог — Вера
Бог и слышит, да не скоро скажет.	Бог — Вера
Бог видит, да нам не сказывает.	Бог — Вера
От людей утаишь, а от бога не утаишь.	Бог — Вера
Перед попом утаишь, а перед богом не утаишь.	Бог — Вера
Бога не обманешь, хоть и пораньше нашего встанешь.	Бог — Вера
Сколько ни мудри, а воли божьей не перемудришь (ответ  крестьян на нововведения).	Бог — Вера
Ни он (бог) тебя, ни ты его не обманешь.	Бог — Вера
Ни хитру, ни горазду, ни убогу, ни богату суда божьего не  миновать.	Бог — Вера
Что народ увидит, то и бог услышит.	Бог — Вера
Бог виноватого найдет.	Бог — Вера
Бог всякую неправду сыщет.	Бог — Вера
Бог не Никитка, повыломает лытки (т. е. накажет).	Бог — Вера
Бог накажет, никто не укажет.	Бог — Вера
Стреляй в куст, бог (или: пуля) виноватого сыщет.	Бог — Вера
Бог не свой брат, не увернешься.	Бог — Вера
От бога не уйдешь. От божьей власти (или: кары) не уйдешь.	Бог — Вера
Суда божьего околицей не объедешь.	Бог — Вера
Его сам бог пометил (или: запятнал, покарал).	Бог — Вера
Кого бог любит, того и наказует.	Бог — Вера
Наказуя, наказа мя господь, но смерти не предаде.	Бог — Вера
Кто богу угоден, тот и людям приятен (или: пригоден).	Бог — Вера
Живем, поколе господь грехам нашим терпит.	Бог — Вера
На этом свете помучимся, на том порадуемся.	Бог — Вера
Начало премудрости — страх господень.	Бог — Вера
Бога ты не боишься! Бога бойся!	Бог — Вера
Бог суди твои костыли (т. е. лукавство).	Бог — Вера
Бог тебя суди! Бог тебе судья! Бог его накажи!	Бог — Вера
С богом (т. е. иди, начинай и пр.).	Бог — Вера
Бог с тобою (т. е. прощаю, благословляю; или: отойди,  отвяжись; или: опомнись, образумься).	Бог — Вера
Перед богом все равны. Перед богом все холопы. Все мы рабы  божьи.	Бог — Вера
У бога и живых царей много.	Бог — Вера
Не бойся никого, кроме (или: только) бога одного.	Бог — Вера
У бога выслужишь, у людей никогда (о неблагодарности).	Бог — Вера
Коли не людям в честь, ин (или: так) богу в славу.	Бог — Вера
На весь мир и сам бог не угодит.	Бог — Вера
Молись, а злых дел берегись!	Бог — Вера
На бога надейся, а сам не плошай!	Бог — Вера
Богу молись, а в делах не плошись!	Бог — Вера
Богу молись, а добра-ума держись!	Бог — Вера
Богу молись, а к берегу гребись!	Бог — Вера
Бог богом, а люди людьми.	Бог — Вера
Плачься богу, а слезы — вода.	Бог — Вера
Царь далеко, а бог высоко. До царя далеко, до бога высоко  (по разным произношениям: высоко, далеко; по-владимирски: высоко, далеко).	Бог — Вера
Кто добро творит, тому бог отплатит.	Бог — Вера
За добро бог плательщик.	Бог — Вера
Кто добро творит, того бог благословит.	Бог — Вера
В небо приходящим отказу не бывает.	Бог — Вера
У бога для праведных места много.	Бог — Вера
За (На) кого бог, за (на) того и добрые люди.	Бог — Вера
Удаляющиеся от бога погибают.	Бог — Вера
И рано встал, да бог не пристал (о неудаче).	Бог — Вера
Коли господь не сохранит града, то всуе стража и ограда.	Бог — Вера
Не сохранит господь града, не сохранит ни стража, ни ограда.	Бог — Вера
Коли господь не построит дома, и человек не построит.	Бог — Вера
Без бога ни до порога.	Бог — Вера
С бога начинай и господом кончай!	Бог — Вера
Утром бог и вечером бог, а в полдень да в полночь никто же,  кроме его.	Бог — Вера
Благослови, господи, достояние твое!	Бог — Вера
Всякое житейское отложим попечение!	Бог — Вера
Богу молиться — вперед пригодится.	Бог — Вера
Молитва — полпути к богу (или: ко спасению).	Бог — Вера
Молись иконе да будь в покое!	Бог — Вера
Проси Николу, а он спасу скажет.	Бог — Вера
Сей, рассевай, да на небо взирай!	Бог — Вера
Кто перекрестясь работает, тому божья помощь.	Бог — Вера
Кто не окстясь за стол садится, с тем ест и пьет диавол.	Бог — Вера
Перейти крест — грех на душу (т. е. пройти впереди  молящегося).	Бог — Вера
Кто без крестов (т. е. без тельного креста), тот не Христов.	Бог — Вера
Без креста и молитвы не будут ловитвы.	Бог — Вера
За ладью хватайся (на промыслах), богу конайся (кучься).	Бог — Вера
С молитвой в устах, с работой в руках.	Бог — Вера
Не торопись, сперва богу помолись!	Бог — Вера
К вечерне в колокол — всю работу об угол.	Бог — Вера
Первый звон — чертям разгон; другой звон — перекстись;  третий звон — облокись (оденься, иди в церковь).	Бог — Вера
Первый звон — пропадай мой сон; другой звон — земной поклон;  третий звон — из дому вон!	Бог — Вера
Не слушай, где куры кудахчут, а слушай, где богу молятся!	Бог — Вера
Благословясь, не грех (т. е. дело, на которое могу посягнуть  с молитвою, не грешное).	Бог — Вера
Что бы ни пришло, все молись!	Бог — Вера
Одно трости: господи, прости!	Бог — Вера
Одно знай: господи, помилуй и отыми и подай!	Бог — Вера
Дело не спорится — углам помолиться.	Бог — Вера
Лихо думаешь — богу не молись.	Бог — Вера
Не для бога молитва, а для убожества.	Бог — Вера
Богу хвала, а вам (а добрым людям) честь и слава.	Бог — Вера
Свет в храмине от свечи, а в душе от молитвы.	Бог — Вера
С верой нигде не пропадешь.	Бог — Вера
Без веры живут на этом свете, а на том не проживешь.	Бог — Вера
Пораньше просыпайся, да за бога хватайся!	Бог — Вера
Спаси, господи, люди твоя (и благослови достояние твое).	Бог — Вера
Хлеб-соль величай (т. е. молись после еды).	Бог — Вера
Славите бога, так слава и вам!	Бог — Вера
Не скажешь аминь, так и выпить не дадим.	Бог — Вера
Божье забудешь, и своего не получишь.	Бог — Вера
На божье посягать — свое потерять.	Бог — Вера
Напади бог, нападут и добрые люди.	Бог — Вера
«Господи, помилуй!» — не грех говорить и не тяжело носить.	Бог — Вера
«Господи, помилуй!» — не тяжело говорить и легко носить.	Бог — Вера
Наше дело: «Помилуй, бог!», а живет и: «Закрой, Христос!»	Бог — Вера
Буди имя господне благословенно отныне и до века!	Бог — Вера
Шаркни, господи, по душе, по телу, по жене, по детям, по  моему здоровью (говорится при отдержке завесы царских дверей).	Бог — Вера
Не стоит город без святого, селение без праведника.	Бог — Вера
Молитва места не ищет.	Бог — Вера
Коротка молитва «Отче наш», да спасает.	Бог — Вера
Аминь человека спасает.	Бог — Вера
Аминем беса не отшибешь (или: беса не отбудешь).	Бог — Вера
Прости, господи, прегрешения мои!	Бог — Вера
С нами крестная сила! С нами бог и все святые его.	Бог — Вера
Наше место свято!	Бог — Вера
Дома спасайся, а в церковь ходи!	Бог — Вера
Кто попу не сын, тот не законный сын.	Бог — Вера
Велики труды его к богу (т. е. богомол, великопостник).	Бог — Вера
Испостился, измолился в нитку.	Бог — Вера
Не хлебом живы, молитвою.	Бог — Вера
Церковное стяжанье — божье.	Бог — Вера
Церковное достояние — убогих богатство. Крестовая церковь и  кресты правит (см. «Новая скрижаль»).	Бог — Вера
Первую мерлушку попу на опушку!	Бог — Вера
Не отсыпав попу новины, хлеба не продавай!	Бог — Вера
Монастырь докуку любит (т. е. просьбы и приношения).	Бог — Вера
Келья — гроб, и дверью — хлоп!	Бог — Вера
Иконы не купят, а меняют (вместо; не покупают).	Бог — Вера
Образа да ножи не дарят, а меняют.	Бог — Вера
Кто понедельничает, возрадуется заступничеству архангела  Михаила.	Бог — Вера
Скоромничают бары да собаки.	Бог — Вера
Великий пост всем прижмет хвост.	Бог — Вера
Одно спасенье — пост да молитва.	Бог — Вера
Середа да пятница хозяину в доме не указчица.	Бог — Вера
Бог даст совет, так и в пост мясоед.	Бог — Вера
Постись духом, а не брюхом!	Бог — Вера
Послушание паче поста и молитвы.	Бог — Вера
Не сквернит в уста, а сквернит из уст.	Бог — Вера
Не встанет свеча перед богом, а встанет душа.	Бог — Вера
Богу молиться — не вовсе разориться (т. е. надо заняться и  мирским).	Бог — Вера
Повадишься к вечерне — не хуже харчевни: ныне свеча — ан  шуба с плеча (укор скупых мужей женам).	Бог — Вера
Не нужны нам праведники, нужны угодники (т. е. нам  угождающие).	Бог — Вера
Пению время, а молитве час.	Бог — Вера
Грех в мех, а сам вверх (или: наверх).	Бог — Вера
Грех под лавку, а сам на лавку.	Бог — Вера
Хлеб ест, а креститься не умеет.	Бог — Вера
Много кающих(ся), да мало воротящих(ся).	Бог — Вера
Поено да кормлено, а дома не помолено.	Бог — Вера
Поп сидя обедню служит, а приход (а миряне) лежа богу  молятся.	Бог — Вера
Одному мигнул, другому кивнул, а третий и сам догадается (о  нерадивой молитве).	Бог — Вера
Знают и чудотворцы, что мы не богомольцы.	Бог — Вера
Научились шить долгие хвосты — позабыли великие посты.	Бог — Вера
На дудку есть, а на свечку нет (т. е. денег).	Бог — Вера
На балалайку станет, и на кабак станет, а на свечку не  станет.	Бог — Вера
В тревогу — и мы к богу, а по тревоге — забыли о боге.	Бог — Вера
Хоть церковь и близко, да ходить склизко; а кабак  далеконько, да хожу потихоньку.	Бог — Вера
